Job Title,Salary Estimate,Job Description,Rating,Company Name,Location,Headquarters,Size,Founded,Type of ownership,Industry,Sector,Revenue,Competitors
Java Senior Software Engineer,-1,"Java Senior Software Engineer
Be a part of a team that’s ensuring Dell Technologies' product integrity and customer satisfaction. Our IT Software Engineer team turns business requirements into technology solutions by designing, coding and testing/debugging applications, as well as documenting procedures for use and constantly seeking quality improvements.
Dell Digital Core Accounting organization is seeking a software developer with around 8 years of market experience to join an energetic, fast paced environment. You will work on a development team to support development of products for Dell Finance Accounting business, that includes design, code, unit test, debug and document software according to Dell's systems standards, policies and procedures, as well as interact with business users and IT to define current and future state for our the products we own in our segment.
Our area is focused on customizations and integrations with Oracle EBS ERP and one of our main strategy is continue to invest on building those products outside of the package leveraging our private Cloud (PCF - Pivotal Cloud Foundry). So, we are looking for a Software Engineer to help the transformation on building solutions on this Platform.
Join us as a Senior Software Engineer on our Information Technology team in Brazil/Eldorado do Sul to do the best work of your career and make a profound social impact.

What you’ll achieve
As an IT Senior Software Engineer, you will deliver products and improvements for a changing world. Working at the cutting edge, you will craft and develop software for platforms, peripherals, applications and diagnostics — all with the most sophisticated technologies, tools, software engineering methodologies and partnerships.

You will:
Design specifications for high availability and highly scalable applications which will be used by both internal and external customers
Work with clients and business partners to settle software requirements and system impacts
Manage projects with small to moderate budgets; may perform in project the main role and/or supervise the activities of lower-level personnel
Conduct and supervise production launches and post-launch support, coordinating with geographically distributed teams in conference calls

Take the first step towards your dream career
Every Dell Technologies team member brings something unique to the table. Here’s what we are looking for with this role:

Essential Requirements
Strong PL/SQL development experience and Java Sprint Boot development experience
Good C#.NET development experience
Experience working with Agile methodologies like SCRUM and Extreme Programming.
Experience preparing flow charts and systems diagrams to assist in problem and system documentation
Collaborative and teamwork skills and ability to work independently and manage small development teams

Desirable Requirements
Experience with integration with package applications (e.g.: ERP, CRM, etc) and Knowledge on Oracle EBS Financial modules
Good experience working with global teams.
Here’s our story; now tell us yours
Dell Technologies helps organizations and individuals build a brighter digital tomorrow. Our company is made up of more than 150,000 people, located in over 180 locations around the world. We’re proud to be a diverse and inclusive team and have an endless passion for our mission to drive human progress.

What’s most important to us is that you are respected, feel like you can be yourself and have the opportunity to do the best work of your life - while still having a life. We offer excellent benefits, bonus programs, flexible work arrangements, a variety of career development opportunities, employee resource groups, and much more.

We started with computers, but we didn’t stop there. We are helping customers move into the future with multi-cloud, AI and machine learning through the most innovative technology and services portfolio for the data era. Join us and become a part of what’s next in technology, starting today.

You can also learn more about us by reading our latest Diversity and Inclusion Report and our plan to make the world a better place by 2030 here.

Application closing date: 20 Jan 2021.

Dell is committed to the principle of equal employment opportunity for all employees and to providing employees with a work environment free of discrimination and harassment. All employment decisions at Dell are based on business needs, job requirements and individual qualifications, without regard to race, color, religion or belief, national, social or ethnic origin, sex (including pregnancy), age, physical, mental or sensory disability, HIV Status, sexual orientation, gender identity and/or expression, marital, civil union or domestic partnership status, past or present military service, family medical history or genetic information, family or parental status, or any other status protected by the laws or regulations in the locations where we operate. Dell will not tolerate discrimination or harassment based on any of these characteristics. Dell encourages applicants of all ages. Read the full Equal Employment Opportunity Policy here.",4.6,"Dell Technologies
4.2",Eldorado do Sul,-1,51 to 200 Employees,2019,Company - Private,IT Services,Information Technology,Unknown / Non-Applicable,-1
Machine Learning Engineer,-1,"A Birdie nasceu com o propósito de amplificar a voz dos consumidores em sua relação com as marcas, permitindo que empresas possam melhorar a jornada de compra e consumo de seus clientes. Para isso, geramos insights práticos sobre a experiência dos consumidores com produtos, marcas e canais de venda durante a jornada de compra, ajudando nossos clientes a tomarem decisões de negócios baseadas na voz do consumidor.
Nossos valores são:
No ego! Collaboration: We are stronger as a team.
Do your best! Passion: We love and put our best in what we do.
Own it! Accountability: We own what we do and focus on generating impact.
Dream big! Courage: We welcome and embrace challenges.
Be different! Diversity: We value and respect different opinions and people.
Para atingir este propósito, precisamos começar dentro de casa, amplificando a voz de todos os grupos de pessoas também na Birdie e trazendo para nosso time pessoas com os mesmos valores que os nossos.
Para isso, buscamos uma pessoa para projetar, desenvolver e manter um sistema de MLOps (DevOps para Machine Learning) afim de criar um pipeline automatizado de implantação, atualização, testes e monitoria de pipeline de dados que envolvem modelos de Machine Learning ou outras abordagens de transformação de dados. Seu trabalho deverá facilitar, acelerar e melhorar a qualidade da implantação em produção de modelos de dados para todo o time de Data Scientists. Você integrará um time multidisciplinar que envolve principalmente Data Engineers e Data Scientists que atuam em conjunto para enriquecer e estruturar (principalmente com técnicas de Processamento de Linguagem Natural) milhões de dados sobre opiniões de consumidores coletados de múltiplas fontes e em formato não-estruturado. A saída final desse processo é um banco de dados estruturado e fácil de ser consultado por um Analytics que tem como objetivo de extrair insights úteis para grande empresas sobre seus consumidores.
Um boa fonte de inspiração do que queremos pode ser encontrada neste artigo: [https://cloud.google.com/solutions/machine-learning/mlops-continuous-delivery-and-automation-pipelines-in-machine-learning](https://cloud.google.com/solutions/machine-learning/mlops-continuous-delivery-and-automation-pipelines-in-machine-learning)
Você irá:
Projetar, implementar e manter o processo de MLOps;
Apoiar cientistas de dados nas melhores práticas de desenvolvimento de modelos para produção;
Apoiar no desenvolvimento do data lake e de feature stores voltadas a facilitar o trabalho de cientistas de dados;
Manter um processo de monitoria da qualidade dos modelos e seus dados gerados em produção.
O que buscamos:
Formação em Ciência da Computação, Engenharia da Computação, Sistema de Informação, Estatística ou curso relacionado;
Conhecimento em modelagem de dados e de arquiteturas de dados;
Experiência em programação em linguagem Python e SQL;
Experiência em ambiente AWS (Athena, Lambda, S3, Step Functions, outros) e arquitetura Serverless;
Experiência em ambiente de computação distribuída (e.g. Hadoop/Spark);
Experiência ou conhecimento de frameworks de Machine Learning (TensorFlow, Keras, scikit-learn);
Experiência em ferramentas de apoio ao ciclo de vida de modelo de Machine Learning (MLFlow, KubeFlow, SageMaker, CookieCutter Data Science e DVC);
Experiência em trabalhar com metodologia de desenvolvimento ágil;
Inglês intermediário.
O que te oferecemos:
Regime de contratação CLT;
Ambiente descontraído, de alto crescimento, com foco em resultado e inovação;
Vale Refeição/Alimentação flexível - Vee Food;
Ajuda com custos pessoais - Vee Utilities - com descontos em academias, psicólogos e muito mais;
Plano de saúde;
Plano odontológico;
Seguro de vida;
Horário de trabalho flexível.
Tipo de vaga: Tempo Integral, Efetivo/CLT
Salário: R$5.000,00 - R$8.000,00 por mês
Benefícios:
Assistência médica
Assistência odontológica
Convênios e descontos comerciais
Seguro de vida
Trabalho remoto
Vale-alimentação
Vale-refeição
Horário de trabalho:
Horário flexível",-1,birdie.ai,São Carlos,-1,-1,-1,-1,-1,-1,-1,-1
Senior Data Engineer,-1,"JOB PURPOSE AND IMPACT
The Data Engineer will design, build and operate high performance data centric solutions utilizing the comprehensive big data capabilities for the company’s data platform environment.
In this role, you will act as an authority for data access pathways and techniques working with analysts within the functional data analytics team.
You will design data structures and pipelines to collect data and design and implement data transformations, combinations or aggregations.

KEY ACCOUNTABILITIES
Collaborate with businesses, application and process owners, and product team members to define requirements and design solutions for the company’s big data and analytics solutions.
Participate in the decision-making process related to architecting solutions.
Develop technical solutions utilizing big data and cloud based technologies and ensuring they are designed and built to be sustainable and robust.
Perform data modeling and prepare data in databases for use in various analytics tools and configurate and develop data pipelines to move and optimize data assets.
Provide necessary technical support through all phases of solution life cycle.
Build prototypes to test new concepts and be a key contributor of ideas and code that improve the core software infrastructure, patterns and standards.
Help drive the adoption of new technologies and methods within the functional data and analytics team and be a role model and mentor for data engineers.
Independently handle complex issues with minimal supervision, while escalating only the most complex issues to appropriate staff.
Other duties as assigned.
MINIMUM QUALIFICATIONS
Bachelor’s degree in a related field or equivalent experience
Minimum of four years of related work experience
Proven experience using any Hadoop Distribution, preferably Cloudera, to build solutions that deliver value through leveraging data as an asset
Understanding of Cloud Computing
Proven experience in building batch and streaming data pipelines using Sqoop, Kafka and/or Spark
Proven experience using SQL or noSQL
Experience developing software using agile methodologies such as Scrum and/or Kanban
Strategic thinking, problem solving, and analytical skills
Strong interpersonal skills, ability to build trust and relationships and influencing others
Result orientation and ability to work in ambiguous situations where requirements are not clear
Experience with Unix shell scripting
PREFERRED QUALIFICATIONS

Experience with reporting and analytics tools
Experience working with various types of data sources such as SAP, JDE and other ERP systems
Proficiency in at least one backend programming language such as Java, Phyton, C#, Golang
Experience building CI/CD pipelines",3.9,"Cargill
3.9",Brazil,-1,10000+ Employees,1865,Company - Private,Food Production,Agriculture & Forestry,$10+ billion (USD),-1
IT Application Management Engineer,-1,"IT Application Management Engineer
Be part of a team that’s ensuring Dell Technologies' products stability and customer satisfaction. Our IT Application Management team guarantees high availability of multiple application ecosystems by providing specialized support to a great variety of technologies, designing monitoring solutions and combining continuous delivery frameworks to IT environments support practices.
Join us as an Application Management Engineer on our Information Technology team in Porto Alegre to do the best work of your career and make a profound social impact.
What you’ll achieve...
As an IT Application Management Engineer, you will deliver the next-generation software environment improvements, stability and integration, creating the foundation that supports new products, which will take Dell Technologies systems and business to next level — all with the most sophisticated technologies, tools, software engineering methodologies and partners.
You will:
Work with business applications and cross-functional IT and business teams
Work on programs of diverse scope, applying your skills on troubleshooting and resolving disruptions of distributed system solutions
Assist in code development, test, integration and enhancements of new and existing environment management tools and automations
Collaborate on continuous improvements of application environments, with a major focus on the best user experience, performance, stability, scalability and future expansions
Take the first step towards your dream career
Every Dell Technologies team member brings something unique to the table. Here’s what we are looking for with this role:
Essential Requirements
Understanding of intersystem dependencies around primary and distributed applications;
Knowledge on monitoring, managing, resolving and documenting issues and events related to system and application environments availability;
Ability drive problem solving and debugging strategies for problems that involve multiple applications and technologies;
Knowledge on Windows and Linux based systems
Experience with Oracle Databases, Oracle Weblogic Oracle Packages - Siebel and/or EBS
Clear communication and teamwork skills
Desirable Requirements
Previous experience with Environment Support & Problem Management, ITIL, Continuous Integration/Development and Pipelines
IBM MQ, Cloud Based Applications
Here’s our story; now tell us yours!
Dell Technologies helps organizations and individuals build a brighter digital tomorrow. Our company is made up of more than 150,000 people, located in over 180 locations around the world. We’re proud to be a diverse and inclusive team and have an endless passion for our mission to drive human progress.
What’s most important to us is that you are respected, feel like you can be yourself and have the opportunity to do the best work of your life - while still having a life. We offer excellent benefits, bonus programs, flexible work arrangements, a variety of career development opportunities, employee resource groups, and much more.
We started with computers, but we didn’t stop there. We are helping customers move into the future with multi-cloud, AI and machine learning through the most innovative technology and services portfolio for the data era. Join us and become a part of what’s next in technology, starting today.
You can also learn more about us by reading our latest Diversity and Inclusion Report and our plan to make the world a better place by 2030 here.
Dell is committed to the principle of equal employment opportunity for all employees and to providing employees with a work environment free of discrimination and harassment. All employment decisions at Dell are based on business needs, job requirements and individual qualifications, without regard to race, color, religion or belief, national, social or ethnic origin, sex (including pregnancy), age, physical, mental or sensory disability, HIV Status, sexual orientation, gender identity and/or expression, marital, civil union or domestic partnership status, past or present military service, family medical history or genetic information, family or parental status, or any other status protected by the laws or regulations in the locations where we operate. Dell will not tolerate discrimination or harassment based on any of these characteristics. Dell encourages applicants of all ages. Read the full Equal Employment Opportunity Policy here.",4.2,"Dell Technologies
4.2",Eldorado do Sul,-1,10000+ Employees,1984,Company - Public,IT Services,Information Technology,$10+ billion (USD),-1
Intern Data Engineer,-1,"Who we are
Artefact is a new generation of a data service provider, specialising in data consulting and data-driven digital marketing, dedicated to transforming data into business impact across the entire value chain of organisations. We are proud to say we're enjoying skyrocketing growth.
Our broad range of data-driven solutions in data consulting and digital marketing are designed to meet our clients' specific needs, always conceived with a business-centric approach and delivered with tangible results. Our data-driven services are built upon the deep AI expertise we've acquired with our 1000+ client base around the globe.
We have 1000 employees across 20 offices who are focused on accelerating digital transformation. Thanks to a unique mix of company assets: State of the art data technologies, lean AI agile methodologies for fast delivery, and cohesive teams of the finest business consultants, data analysts, data scientists, data engineers, and digital experts, all dedicated to bringing extra value to every client.

Your responsibilities :
Innovate. You will work with your team which is made up of consultants, data scientists, creatives and engineers to identify your clients needs and define innovative solutions.
Build. You'll take ownership of the solution from start to end. You manage both conception and implementation, whilst also optimising the performance and scalability.
Train. You will work in a collaborative team which champions knowledge sharing. You will coach others, keep abreast of industry news/updates and get stuck into training sessions with our business partners and suppliers, such as Google & Amazon.
Communication. You will regularly attend events and conferences to share your knowledge, learnings and success, with the capability of presenting and communicating
Your mindset
Curious, you are always seeking innovative solutions for your clients. You are involved in all the value chain which can be, front-end, back-end, big data infrastructure, ML model …
Sharing of knowledge is essential for you and you actively participate in the diffusion of information within Artefact (seminaries, formations, certifications)
Entrepreneurial, you bring solutions, new ideas, within your team at Artefact
Profile :
You act on all the value chain of projects (infrastructures and platforms creation, data collection, application of machine learning models, APIs REST creations, of front-ends, of tests, continuous deployments)
You have a good knowledge of python (Java and Scala are an asset), you know how to navigate *nix thank to CLI, you are familiar or have already used cloud technologies such as GCP or AWS, you have already used bug data technologies like Flink, Spark, or Beam and Docker (K8S is an asset)
You can popularize technical terms or solutions to more business oriented profiles, you can work in a team with very diversified profiles
You know how to prioritize your tasks, respect deadlines, prevent in case of problems
You have a good level of English


Why join us :
Innovative projects and technologies, exciting
Really competent team, co-progression guaranteed
Strong ambition for the data department, full of progression opportunities (technical, management)
Recent Stack : Python, Spark, React/Redux, Google Cloud Platform (BQ, Dataflow, Compute Engine…), Nifi, HDFS, Ansible, Docker, Redis, ...
Come join us !",3.4,"Artefact
3.4",São Paulo,-1,501 to 1000 Employees,2014,Company - Private,Consulting,Business Services,Unknown / Non-Applicable,-1
