Job Title,Salary Estimate,Job Description,Rating,Company Name,Location,Headquarters,Size,Founded,Type of ownership,Industry,Sector,Revenue,Competitors
Data Scientist,-1,"Introduction
As a Data Scientist at IBM, you will help transform our clients data into tangible business value by analyzing information, communicating outcomes and collaborating on product development. Work with Best in Class open source and visual tools, along with the most flexible and scalable deployment options. Whether its investigating patient trends or weather patterns, you will work to solve real world problems for the industries transforming how we live.

Your Role and Responsibilities
The IBM Chief Analytics Office (CAO) is an elite analytics consulting team that is tasked by IBM executives to pursue our most complex strategic issues. Our work is a combination of data science and management consulting. Through state of the art technology, and the power of artificial intelligence we strive to improve traditional business decision-making and processes. We are looking for computer scientists/software engineers to help design and build applications and services to enable the deployment of the machine learning/analytics solutions.

IBM Chief Analytics Office (CAO) is looking for data scientists or machine learning engineers with proven practical skills in machine learning, statistical modeling, data analysis, and data visualization.

Duties & Responsibilities:
Pull and explore large and complex datasets from different IBM databases.
Clean data and develop proof-of-concept machine learning models to resolve business question.
Write modular code and implement machine learning models into production-level solution.
Assist in setting up the infrastructure and evaluation tests
Perform data analysis and help address questions and feedback from users
Develop and deploy microservices and containers in production- and prototype-level cloud environments.

Oportunidade em São Paulo e Hortolândia/SP

Todas as nossas vagas são elegíveis para pessoas com deficiência ou reabilitadas

Required Technical and Professional Expertise
B.S. or higher degree in Data Science, Statistics, Computer Science or related disciplines
Programming in Python (e.g., numpy, pandas, scikit-learn, keras, etc)
Experience working with a SQL data warehouse
Experience with building and explaining machine learning models
Experience with collaborative and agile management tools: GitHub
Strong English written and verbal communication skills
Ability to understand, articulate and/or document technical specification

Preferred Technical and Professional Expertise
Experience with a relational database: IBM DB2, MySQL, PostgreSQL, MS SQL Server
Established expertise building production-level software applications
Experience with distributed frameworks: Apache Spark, Storm, Flink, and/or Kafka
Experience with containerization environments: Docker, Kubernetes, or OpenShift

About Business Unit
The IBM Finance organization is responsible for driving enterprise performance and transformation. We are the financial stewards of IBM, delivering IBMs financial strategy, developing new business models, and mitigating enterprise risk. Do you have a passion for creating business value? Join our team in accounting, financial planning, pricing, business controls, tax, treasury, business development (acquisitions & divestitures), and global financing.

Your Life @ IBM
What matters to you when youre looking for your next career challenge?

Maybe you want to get involved in work that really changes the world? What about somewhere with incredible and diverse career and development opportunities where you can truly discover your passion? Are you looking for a culture of openness, collaboration and trust where everyone has a voice? What about all of these? If so, then IBM could be your next career challenge. Join us, not to do something better, but to attempt things you never thought possible.

Impact. Inclusion. Infinite Experiences. Do your best work ever.

About IBM
IBMs greatest invention is the IBMer. We believe that progress is made through progressive thinking, progressive leadership, progressive policy and progressive action. IBMers believe that the application of intelligence, reason and science can improve business, society and the human condition. Restlessly reinventing since 1911, we are the largest technology and consulting employer in the world, with more than 380,000 IBMers serving clients in 170 countries.

Location Statement
For additional information about location requirements, please discuss with the recruiter following submission of your application.

Being You @ IBM
IBM is committed to creating a diverse environment and is proud to be an equal opportunity employer. All qualified applicants will receive consideration for employment without regard to race, color, religion, gender, gender identity or expression, sexual orientation, national origin, genetics, pregnancy, disability, age, veteran status, or other characteristics. IBM is also committed to compliance with all fair employment practices regarding citizenship and immigration status.",4.2,"IBM
4.2",Hortolândia,-1,10000+ Employees,1911,Company - Public,IT Services,Information Technology,$10+ billion (USD),-1
Data Engineer Senior,-1,"A posição de Data Engineer está em nosso time de Tecnologia. O nosso maior desafio é trabalhar em conjunto com nossas equipes multifuncionais para ajudá-las a projetar e construir nossos produtos. Esperamos que você seja apaixonado por programação e arquitetura. Você também deve se sentir confortável trabalhando em um ambiente dinâmico e em ritmo acelerado.

Sobre ambiente de tecnologia da Amparo Saúde:

Aprendemos constantemente! Errar faz parte do processo de evolução;

Somos orientados a produtos concebidos por times multidisciplinares;

Valorizamos um ambiente de trabalho que estimula a criatividade e o bem-estar.

Porque precisamos de você:

Nós usamos tecnologia para alavancar nosso negócio, por isso é o coração da empresa! Buscamos ajuda para construir decisões de arquitetura e garantir a qualidade dos nossos serviços.

Aqui você é livre para ser você! Valorizamos a pluralidade e equidade de raça, cor, religião, identidade de gênero, nacionalidade, deficiência, orientação sexual, ascendência ou idade. Para nós, ser plural é valorizar e respeitar as diferenças com empatia e ter equidade significa promover e garantir oportunidades e condições justas para todas as pessoas e grupos. Com backgrounds e perspectivas diferentes, conseguimos entender nossos (as) clientes de verdade e encontrar as melhores soluções.

Responsabilidades e atribuições

Como será o seu dia a dia:

Você vai atuar em um ambiente de Squads autônomas responsáveis por todo o processo de desenvolvimento e release de software. Também será sua responsabilidade em garantir que os projetos estão em conformidade com as metodologias que utilizamos, entendendo e trabalhando a melhoria do nosso produto no dia a dia, colaborando com a evolução da plataforma através de novas ideais, novos pontos de vista e assim elaborar novas funcionalidades que brilhem os olhos dos nossos usuários.

Requisitos e qualificações

Conhecimentos que precisamos que tenha:

• Experiência em contextos de evolução e manutenção de ambientes Big Data produtivos;

• Conhecimentos de processamento paralelo e distribuído;

• Conhecimento de bancos de dados SQL e NoSQL (PostgreSQL, SQL Server, Mongo e Cassandra)

• Conhecimento da linguagem Python e Shell Script para automação;

• Experiência com computação em nuvem, preferencialmente AWS e/ou GCP;

• Experiência na captura de dados das mais variadas fontes;

• Experiência na construção e otimização de pipelines de big data, arquiteturas e datasets;

• Conhecimento de enfileiramento de mensagens, processamento de dados em streaming (realtime, near realtime) e armazenamento de dados em larga escala.

Informações adicionais

Onde estamos:

Pertinho da Estação Faria Lima. Av. Brigadeiro Faria Lima, 1336 – 2° andar. Mas é você que escolhe se quer trabalhar no escritório ou Home Office!!

O processo seletivo da Amparo Saúde se inicia na candidatura, podendo ser flexível quanto ao tempo de duração. Mas, não se preocupe, nosso time de Talent Acquisition está preparado para proporcionar a melhor experiência para você!

Analisamos todos os perfis com atenção e sempre enviamos feedbacks, independente da etapa da candidatura. Além disso, todas as instruções são enviadas por e-mail. =)",5.0,"Amparo Saúde
5.0",São Paulo,-1,51 to 200 Employees,-1,Company - Private,-1,-1,Less than $1 million (USD),-1
Database Engineer,-1,"Nossa área de Estratégia e Tecnologia é um pilar fundamental dos nossos negócios, sendo responsável pela nossa transformação digital. Aqui criamos soluções tecnológicas sempre idealizando e desenvolvendo técnicas e processos de automação, seja para aprimorar a experiência de trabalho das nossas equipes ou aumentar a capacidade de entrega dos nossos produtos e serviços.
Reconhecemos a importância da igualdade de oportunidades e cada vez mais valorizamos a diversidade. Todas as pessoas são bem vindas nos nossos processos e nos nossos times . Quer fazer parte disso com a gente?
Como será seu dia a dia:
Esta posição é para trabalhar no time de banco de dados responsável por acompanhar os vários projetos digitais da Globo. Procuramos um especialista de banco de dados com perfil de DevOps para trabalhar em conjunto com os times de desenvolvimento e infra buscando as soluções mais otimizadas de banco de dados para cada projeto. Este profissional será responsável por levantar, definir, implementar e acompanhar os projetos de banco de dados em ambientes na nuvem e on premisse usando diversas tecnologias como NoSQL , replicaç ã o , sharding , containers, automação, etc .
Do que você precisa:
Solida e xperiência em administração de um ou mais dos seguintes DBMS's : MySQL, MongoDB , Redis , Cassandra
Experiência em pelo menos uma das nuvens públicas: AWS, GCP, Azure, OCI
Sólidos conhecimentos de modelagem de dados e tuning de queries
Programação em banco de dados (scripts de ETL, procedures, etc)
Arquiteturas com High Availability / Sharding
Agile Frameworks (Scrum, Kanban, XP, SAFe, etc)
Inglês Avançado
Conhecimentos que podem te destacar:
Programação em Python / Ruby / Javascript / G olang
Puppet /Ansible / Terraforming
Experiência com pipelinesde CI e CD
Containers (Docker/Kubernetes)
Big Data Tools:Google Big Query, Spark , Kafka, etc.
Por que vir para Globo:
Possibilidade de impactar positivamente a vida de milhares de usuários ;
Espaço e autonomia pra você deixar a sua marca ;
Ambiente descontraído e um time incrível formado por pessoas apaixonadas pelo que fazem e referências em suas áreas de atuação ;
Incentivo ao desenvolvimento profissional constante ;
C ultura open sourc e !
Nesse momento de isolamento social os nossos processos seletivos estão acontecendo de forma 100% remota e encorajamos inscrições de qualquer lugar do Brasil . Vem pra Globo!
Quer saber mais sobre como é #EstarNaGlobo? Dá pra acompanhar nosso dia-a-dia, desafios e conquistas nas nossas redes:
https://www.linkedin.com/company/rede-globo
https://www.instagram.com/vempraglobo/
https://www.facebook.com/VemPraGlobo/",4.1,"Grupo Globo
4.1",São Paulo,-1,10000+ Employees,1965,Company - Private,Internet,Information Technology,$10+ billion (USD),-1
Data Engineer (Senior to Lead role),-1,"Overall Experience :
6 to 12 years
Job location :
Coimbatore or work from home
Responsibilities :
Candidate with 6+ years of experience in a Data Domain and specialization in Design and Architectures for at least 3 yrs in Artificial Intelligence and Machine Learning
Experience in python, Apache spark, Atlas, Livy is a must and exposure on Databricks and react will be preferred.
Have worked with AI/ML application integration and web hook into ReactJS based application. Knowledge and hands on experience in ReactJS is preferred.
Experience with distributed computing systems (AWS, Hadoop, Azure, Google Cloud) and deployment tools such as docker, kubernetes
Design, implement and maintain high performance big data infrastructure/systems, big data processing pipelines scaling to billions of structured and unstructured events daily.
Support product with the overall roadmap and ensure updates to senior leadership are 100% technically correct
Design, Architect, and maintain large Enterprise solutions on the AI/ Ml platform, monitor and provide transparency into data quality across systems (accuracy, consistency, completeness, etc) and optimize as needed
Required Skill set :
Very strong experience in data domain and specialization in Design and Architectures and modelling.
Strong in Python, Spark, Apache, Atlas and livy.
Good experience in modelling working closely for product development
Who you are:
Any Degree with IT/Computer Science background.
Ready to start immediately.
Should be a Self-starter to work with new technologies.
Good Communication skills required.
Should be able to mentor the Jr Developers.
What we can offer you :
Extended health coverage.
Stock Option.
Monthly and quarterly team building activities (fun ones).
Support for professional development.
Paid days off.
Flexible work schedules and work from home days.
Work days – Monday to Friday.
A vibrant, young and awesome team to work with!",-1,INTELLECTYX DATA SCIENCE INDIA,Tocantins,-1,-1,-1,-1,-1,-1,-1,-1
Principal Full Stack Engineer - Services IT,-1,"Principal Full Stack Engineer - Services IT
The Software Engineering team delivers next-generation software application enhancements and new products for a changing world. Working at the cutting edge, we design and develop software for platforms, peripherals, applications and diagnostics — all with the most advanced technologies, tools, software engineering methodologies and the collaboration of internal and external partners.
Join us as a IT Principal Software Engineer on our Information Technology team in Eldorado do Sul, Brazil to do the best work of your career and make a profound social impact.

What you’ll achieve
As an IT Principal Software Engineer, you will be part of a team responsible for end to end development of a Services IT product, with full ownership from defining what the product does to supporting its features for the best customer experience. Beyond code solutioning, development and testing, product lifecycle and its pillars is part of the day to day realities of the engineer in our team, including how to do the best customer engagement, how to monitor the product in multi-environments, what kind of analytics are required, self-services and customer support. The team runs in an agile environment with regular deployment to product (at least once a week) and extreme programming practices.
Working at the cutting edge, you will craft and develop software for platforms, peripherals, applications and diagnostics — all with the most sophisticated technologies, tools, software engineering methodologies and partnerships.
You will:

End to End product development (from understanding requirements to supporting it in production), influencing on what product should or not have – team autonomy.
Work as real full stack engineer, coding, testing and delivering your art into production.
Innovate exploring new technologies and defining the path to the product future.
Be part of a real product team, helping to define its future, raising it to the next Customer Experience level.
Deliver product maturity within the team, concerned with Onboarding, Monitoring, Analytics, Self Service and Support.

Take the first step towards your dream career
Every Dell Technologies team member brings something unique to the table. Here’s what we are looking for with this role:

Essential Requirements
Fast Learning and Logical Skills: Ability to apply extensive knowledge of application programming and analysis
Technical Skills: Proven experience in software development methodologies (Java SB / PCF)
Proactive Ownership: Flexible to not work just coding requirements, but owning and helping to build the best product and customer experience ever
Communication skills, also able to speak fluent Portuguese and English
Visionary and Innovative Mind: able to think out of the box to bring the best of the breed to the product and customers.

Desirable Requirements
Previous Experience with Extreme Programming Practices in an Agile Environment
Bachelor degree or equivalent in Computer Science

Here’s our story; now tell us yours
Dell Technologies helps organizations and individuals build a brighter digital tomorrow. Our company is made up of more than 150,000 people, located in over 180 locations around the world. We’re proud to be a diverse and inclusive team and have an endless passion for our mission to drive human progress.

What’s most important to us is that you are respected, feel like you can be yourself and have the opportunity to do the best work of your life - while still having a life. We offer excellent benefits, bonus programs, flexible work arrangements, a variety of career development opportunities, employee resource groups, and much more.

We started with computers, but we didn’t stop there. We are helping customers move into the future with multi-cloud, AI and machine learning through the most innovative technology and services portfolio for the data era. Join us and become a part of what’s next in technology, starting today.

You can also learn more about us by reading our latest Diversity and Inclusion Report and our plan to make the world a better place by 2030 here.

Application closing date: 01 March 2021.

Dell is committed to the principle of equal employment opportunity for all employees and to providing employees with a work environment free of discrimination and harassment. All employment decisions at Dell are based on business needs, job requirements and individual qualifications, without regard to race, color, religion or belief, national, social or ethnic origin, sex (including pregnancy), age, physical, mental or sensory disability, HIV Status, sexual orientation, gender identity and/or expression, marital, civil union or domestic partnership status, past or present military service, family medical history or genetic information, family or parental status, or any other status protected by the laws or regulations in the locations where we operate. Dell will not tolerate discrimination or harassment based on any of these characteristics. Dell encourages applicants of all ages. Read the full Equal Employment Opportunity Policy here.",4.2,"Dell Technologies
4.2",Eldorado do Sul,-1,10000+ Employees,1984,Company - Public,IT Services,Information Technology,$10+ billion (USD),-1
"Data Engineer, Mid Level",-1,"Olá.

Estamos com oportunidades para juntar-se ao nosso time de Analistas de Big Data.

Se você conhece o assunto e tem interesse em envolver-se em projetos dessa natureza, venha bater um papo com a gente. =)

Conhecimento Obrigatório:
Java (Back-End).
SQL.
Linux ShellScript

Conhecimento Desejável:

o NoSQL
o GPDB
o Ecossistema Hadoop

o Gemfire
o RabbitMQ
o Spring Framework (SpringBoot, SpringXD, Spring Cloud Data Flow)

Experiência Obrigatória:

Experiência profissional atuando como desenvolvedor Java em projetos de grande porte, principalmente em aplicações distribuídas.
Experiência comprovada como “hard user” em Linux/Unix

# Atenção

Se você estiver vendo essa vaga em outra plataforma que não seja nosso site ou Breezy, candidate-se em https://digiage.com.br/jobs/",4.7,"Digiage Technologies
4.7",São Paulo,-1,Unknown,-1,Company - Private,-1,-1,Less than $1 million (USD),-1
Data Engineer Sr,-1,"Hoje a Easy Carros está presente em todo o país, desenvolvendo tecnologia para facilitar o dia a dia das locadoras em seus três pontos principais: financiamento, compra de veículos e operação (manutenção automotiva e gestão de multas e condutores). Temos, uma nada fácil, missão de aumentar o acesso de 100 milhões de pessoas na América Latina a bens e serviços ao oferecer inteligência de dados, maior controle e gestão operacional para o ecossistema de mobilidade.

Como você poder ver, estamos construindo algo fora do comum, e aqui você vai encontrar a oportunidade de fazer parte disso tudo!

Buscamos profissionais que queiram levar os melhores dados para nossos negócios e parceiros, se desafiar todos os dias entrando cada vez mais no nosso setor.

Responsabilidades e atribuições

Como Data Engineer seus desafios serão:
Análise de dados e criação de Dashboards do negócio;
Criação de Data Warehouses que suporte a transição de dados entre negócios; (um grande banco de dados, baú, com todos as info dos negócios da easy);
Desenvolvimento e manutenção de Data Lake (sistema ou repositório de dados armazenados em seu formato natural/bruto) que permita dar escalabilidade as análises;
Trabalhar como consultor dos times de negócio, entendendo os principais problemas e desafios e traduzindo esses temas em projetos de análises de dados;
Desenvolver ou implementar ferramentas e plataformas de aquisição, transformação, gestão e manipulação de dados em larga escala e com processos complexos;
Prover documentos e treinamentos aos gestores para melhor uso e entendimento das análises dos dados e impacto no negócio;
Interface diária com os Heads e demais gestores do negócio para apresentação e detalhamento de informações com base nos dados.
Automatizar rotinas e padronização;
Implementação de modelo estatísticos (machine learning engineer);
Criação de cenários e geração de informações e estudos;
Padronização de informações e tratamento de dados;
Requisitos e qualificações

Esperamos que você tenha:
Conhecimento sólido em SQL;
Excel Avançado;
Conhecimento em plataformas de ciência de dados, ex: Python, Power BI e Qlikview e Tableau;
Conhecimentos de sistemas de ERP e CRM para geração de integração;
Será um mega diferencial se você tiver:
Experiência no mercado de mobilidade;
Conhecimento em machine learning frameworks e inteligência artificial;
Conhecimentos de Inteligência de Mercado e Pesquisa de Mercado.
Informações adicionais

O que oferecemos?
Um cartão flexível da Vee para você usar com os lanches, compras da semana e o que quiser ;)
Aquele auxílio maroto de saúde com o pessoal da Cuidas;
Acesso a plataforma da Avec com $$ na conta, para você que curte fazer uma tattoo, ter seu dia de beleza e muito mais;
Descontão com nosso cupom na Yuma, a startup de coliving aqui em São Paulo;
Acesso a plataforma da Gama Academy com diversos cursos e treinamentos, para focar no seu aprendizado!
Cansou de gastar com home office? Temo um auxílio para montar seu espaço do jeitinho que você gosta!
Possibilidade de se tornar sócio da Easy Carros ;)
[Todo o time da Easy Carros está trabalhando de casa, por isso, pode ficar tranquila(o) que as etapas serão todas feitas online]",3.5,"Easy Carros
3.5",São Paulo,-1,1 to 50 Employees,2014,Company - Private,Enterprise Software & Network Solutions,Information Technology,$1 to $5 million (USD),-1
Senior Data Engineer,-1,"Propz is a technology company pioneer in the application of Big Data stack to leverage retail sales. Our system can understand customer journey, predict more attractive offers and react in real time, reaching the right customers at the right time.
The sum of CRM, advanced behavioral euristics, machine learning, combined with retail expertise allow us to automate multichannel marketing campaigns and bring consistent measurable uplift to retailer revenue.
We want to build the most powerful customer relationship machine with the ability to learn, adapt and act, regardless of human control.

Main activities
Design solutions for productization of advanced analytical algorithms (ex: recommendations)
Verifying good code quality, uniformness, testing coverage
Ensuring production code stability and effectiveness
Data Lake software development: DAOs, helpers, abstractions
Architecture consulting and improving process with infrastructure team

Solid understanding of databases, data procedures, and data administration
Confident Scala and Spark in application for batch processing
Solid understanding of how JVM works
Design patterns, data structures, algorithms, distributed processing
Good code practices, right usage of automation testing
Git, STB, Maven
Excellent analytical thinking and troubleshooting skills
Confident written communication skill in English
Agile practices adopter and believer
It’s good if you have experience with clouds (AWS, GCP) and Hadoop stack products (Hive, HBase, Drill).

What you will find on Propz
Health plan
Dental Plan
Life insurance
Meal voucher
Home-Office
Casual dress code
Day off on your birthday
Opportunity for accelerated growth
Payroll Loans through a simple and uncomplicated platform
Forget boredom! Here we have a challenging environment, where we learn and improve ourselves each day.
Here at Propz we believe in the power of diversity. Our entire selection process is carried out without distinction of race, religion, gender, nationality, disability, sexual orientation, age or any other.",3.9,"Propz
3.9",Trabalho remoto,-1,51 to 200 Employees,2012,Company - Private,Enterprise Software & Network Solutions,Information Technology,Unknown / Non-Applicable,-1
