Job Title,Salary Estimate,Job Description,Rating,Company Name,Location,Headquarters,Size,Founded,Type of ownership,Industry,Sector,Revenue,Competitors
Data Visualization Solutions Engineer,-1,"What We Need:
Do you want to work on the most innovative digital transformation initiatives in the world? Are you ready to collaborate with teams in the United States and throughout Latin America? Can you help one of the fastest-growing Digital Transformation Consultancies in the Americas create the digital future?

Lima Consulting Group is looking for an exceptional, highly motivated Digital Analytics Solutions Engineer, who is eager to be part of a fast-growing international digital transformation consultancy. You will be part of a team that is experiencing rapid growth and was ranked as one of Philadelphia’s 100 Fastest Growing Firms by the Philadelphia Business Journal.

You will work remotely from anywhere in Brazil with our Porto Alegre and Sao Paulo teams to serve our customers throughout the Americas.

At Lima Consulting Group we are looking for individuals who understand the connection between business problems and technology solutions and have the professional and personal skills to create the digital future with and for the world’s leading brands.

Role Description:
Our Solutions Engineers tackle complex digital marketing missions within a multi-disciplinary team. You will deploy and optimize the world’s leading digital marketing clouds. Leverage your proficiency in PHP, .NET, HTML, AJAX and JQuery/JavaScript alongside our online marketing team to manage the technical aspects of customer data platforms (CDPs), Tag Management Systems (TMS) SEO, PPC, marketing automation campaigns, digital analytics, and much, much more.

Responsibilities:
Design and implement digital analytics solutions using a variety tools and technologies consistently across our client’s digital
properties. (Adobe Analytics, Launch, Target, etc.).

Install digital data governance infrastructure to protect and maintain the integrity of our clients’ digital data. This primarily
includes a global solution design reference, technical specifications, and architectural diagrams.

Develop a data quality metrics framework which includes dashboard/scorecard, and monitoring (alerts/triggers).

Publish data validation results and implementation updates on a regular basis in order to ensure that digital tag requests for both
internal and external clients are executed accurately and efficiently, maintaining data integrity.

Validate the data across reporting and analyzing systems are accurate and align to how the business defines them.

Execute quality assurance or user acceptance testing of analytics site tags.

Configure web analytics systems, as needed, to ensure proper data capture and organization.

Quickly respond to client requests while also driving the project to completion

Other Duties:

Earns the Adobe Analytics Developer and Adobe Experience Platform Certificates within 6 months

Maintains professional and technical knowledge by attending educational workshops; researching trends, following market activities, M&A activity, reviewing professional publications; establishing personal networks; monitoring competitors, benchmarking state-of-the-art practices; participating in professional societies

Contributes regularly (at least once a quarter) to the LCG Blog and Twitter feeds

Stays current on industry trends, market activities, and competitors

Eligibility Requirements:
Eligible to travel Internationally (USA) when needed
Master’s Degree or equivalent industry experience
10+ years’ experience in industry
Proven track record of leadership, collaboration, and talent development within a multi-disciplinary team
Understanding of Customer Data Platforms, Data Management Platforms, Ad Tech, and any of the web analytics and/or Business Intelligence tools such as Adobe Analytics, Google Analytics, Cognos, Qlik, Business Objects, Informatica, MicroStrategy, Tableau etc…

Preferred Candidates:
Excellent relationship management, strong influencing, and communication skills at senior level
Experience of Agile and DevOps
A history of leading customer engagements from a technical perspective as part of a broader team of experts
Experience with SQL or other programming languages (R, Python, Java, and/or C++)
Development experience in at least one scripting language (R, PHP, Perl, Python, etc.)
Experience with streaming data systems and complex event processing: Kafka preferred.
Experience with Big Data, Master Data Management (MDM), Data Visualization, and/or Data Virtualization for both structured and/or unstructured data
Highly polished interpersonal and communication skills.
High degree of initiative, with the ability to evaluate situations and make recommendations",4.0,"Lima Consulting Group, LLC
4.0",Porto Alegre,-1,1 to 50 Employees,2004,Company - Private,-1,-1,Less than $1 million (USD),-1
Salesforce Principal Software Engineer,-1,"Salesforce Principal Software Engineer
The Software Engineering team delivers next-generation software application enhancements and new products for a changing world. Working at the cutting edge, we design and develop software for platforms, peripherals, applications and diagnostics — all with the most advanced technologies, tools, software engineering methodologies and the collaboration of internal and external partners.
Join us as a Salesforce Principal Software Engineer on our Information Technology team in Eldorado do Sul or São Paulo (remote) to do the best work of your career and make a profound social impact.

What you’ll achieve
As an IT Principal Software Engineer, you will deliver products and improvements for a changing world. Working at the cutting edge, you will craft and develop software for platforms, peripherals, applications and diagnostics — all with the most sophisticated technologies, tools, software engineering methodologies and partnerships.

You will:
Develop technical solutions to meet business requirements
Assist in training, work assignment and mentoring of less experienced developers
Provide training and mentor other engineers when required
Be a domain specialist in one or more technical programming specialties

Take the first step towards your dream career
Every Dell Technologies team member brings something unique to the table. Here’s what we are looking for with this role:

Essential Requirements
Ability to apply extensive knowledge of application programming and analysis
Proven experience in software development methodologies
Detailed understanding of key business processes
Ability to communicate and translate needs to technical solutions
Advanced knowledge of automated testing tools and procedures

Desirable Requirements
8+ years of validated experience
Bachelor’s degree in computing engineering or computer science

Here’s our story; now tell us yours
Dell Technologies helps organizations and individuals build a brighter digital tomorrow. Our company is made up of more than 150,000 people, located in over 180 locations around the world. We’re proud to be a diverse and inclusive team and have an endless passion for our mission to drive human progress.
What’s most important to us is that you are respected, feel like you can be yourself and have the opportunity to do the best work of your life - while still having a life. We offer excellent benefits, bonus programs, flexible work arrangements, a variety of career development opportunities, employee resource groups, and much more.
We started with computers, but we didn’t stop there. We are helping customers move into the future with multi-cloud, AI and machine learning through the most innovative technology and services portfolio for the data era. Join us and become a part of what’s next in technology, starting today.
You can also learn more about us by reading our latest Diversity and Inclusion Report and our plan to make the world a better place by 2030 here.
Application closing date: 03 March 2021.

Dell is committed to the principle of equal employment opportunity for all employees and to providing employees with a work environment free of discrimination and harassment. All employment decisions at Dell are based on business needs, job requirements and individual qualifications, without regard to race, color, religion or belief, national, social or ethnic origin, sex (including pregnancy), age, physical, mental or sensory disability, HIV Status, sexual orientation, gender identity and/or expression, marital, civil union or domestic partnership status, past or present military service, family medical history or genetic information, family or parental status, or any other status protected by the laws or regulations in the locations where we operate. Dell will not tolerate discrimination or harassment based on any of these characteristics. Dell encourages applicants of all ages. Read the full Equal Employment Opportunity Policy here.",4.2,"Dell Technologies
4.2",Eldorado do Sul,-1,10000+ Employees,1984,Company - Public,IT Services,Information Technology,$10+ billion (USD),-1
Data Engineer | Full Remote,-1,"Você é a Nossa Melhor Tecnologia!

Somos mais de 900 experts em desenvolvimento de produtos digitais, combinamos metodologias de design, desenvolvimento ágil e novas tecnologias para transformar negócios. Hoje estamos 100% remoto e vamos continuar anywhere! Atualmente estamos entre as TOP 5 das Melhores Empresas para se Trabalhar - Great Place to Work®️ Nacional e de Tecnologia da Informação, 2020!

O que esperamos de você?
Paixão por tecnologia! <3>
Ser fera na construção e arquitetura de pipelines de dados; Programar em Python, Java ou Scala; Conhecer Teste Unitário;Integração Contínua(CI) / Deploy Contínuo(CD); Versionamento (Github, GitLab ou BitBucket); Computação Distribuída (Spark); Orquestrador (Airflow ou Rundeck); Ferramenta de exploração (Jupyter ou Zeppelin); container (Docker, Kubernetes); DB Sql (Mysql, Postgres, Oracle); NoSql (ElasticSearch, MongoDB); Cloud (AWS, Azure, GCP, Dataviz).
Ser uma pessoa colaborativa e gostar de trabalhar em equipe!

Além disso, o que também seria legal você saber?
Metodologias ágeis.

Veja alguns de nossos benefícios!
Plano de Saúde; Plano Odontológico; Seguro de Vida; Vale Refeição; Vale Alimentação; Café da Manhã; Horário Flexível; Home Office; Sem Dress Code; Dextra Snacks; Espaço Fun; Gympass; Biblioteca; Bicicletário; Vestiário; Programa de Mentoria; Plano de carreira; Eventos constantes de compartilhamento de experiências e conhecimentos; Benefícios flexíveis. Para saber mais, fale com a gente!

A Dextra!
Somos especialistas em desenvolvimento de software sob medida dentro da unidade de Transformação Digital do Grupo Mutant. Iniciamos nossos desafios em 2002 e desde então estamos crescendo exponencialmente, presentes no ranking GPTW desde 2009, superando quase 2K de projetos entregues, somando a cultura ágil à rotina de centenas de clientes.

Estamos presentes em Campinas (SP), São Paulo (SP), Curitiba (PR), Ponta Grossa (PR), Florianópolis (SC) e Miami (EUA), mas também temos profissionais atuando 100% remotos.

Atuamos na criação e desenvolvimento de produtos digitais, pioneiros na adoção de metodologias de gestão ágil, combinamos processos de design, UX, novas tecnologias e visão de negócio, desenvolvendo soluções que criam novas oportunidades para nossos clientes.

Cultura!
A nossa cultura é um motivo de orgulho! Por isso é o nosso maior diferencial. Levamos em consideração o comprometimento com o cliente e com a equipe; A valorização da capacidade técnica, da produtividade e da inovação; A colaboração; A Confiança na capacidade das pessoas e Transparência nas relações.

Diversidade!
Apoiamos pessoas independentemente de raça, cor, ancestralidade, religião, sexo, nacionalidade, orientação sexual, idade, cidadania, estado civil, deficiência, identidade de gênero, nível sócio econômico ou qualquer outra característica individual.

Carreira!
Oferecemos todo o apoio para que as pessoas se desenvolvam pessoal e profissionalmente, através de plano de carreira, programa de mentoria, ambiente desafiador e oportunidades de aprendizados constantes.

Então, se você também valoriza tudo isso, curte tecnologias de ponta, muito aprendizado e gosta de novos desafios, aqui é o seu lugar! Isso é a Dextra!

Seja livre para criar e evoluir.

Conheça mais a Dextra pelos nossos canais:

Linked In | Facebook | Instagram | Twitter | Blog | Be Dextra

Voltar para as vagas.",4.6,"Dextra
4.6",Campinas,-1,501 to 1000 Employees,2002,Company - Private,Computer Hardware & Software,Information Technology,Unknown / Non-Applicable,-1
Data Engineer | Full Remote,-1,"Você é a Nossa Melhor Tecnologia!

Somos mais de 900 experts em desenvolvimento de produtos digitais, combinamos metodologias de design, desenvolvimento ágil e novas tecnologias para transformar negócios. Hoje estamos 100% remoto e vamos continuar anywhere! Atualmente estamos entre as TOP 5 das Melhores Empresas para se Trabalhar - Great Place to Work®️ Nacional e de Tecnologia da Informação, 2020!

O que esperamos de você?
Paixão por tecnologia! <3>
Ser fera na construção e arquitetura de pipelines de dados; Programar em Python, Java ou Scala; Conhecer Teste Unitário;Integração Contínua(CI) / Deploy Contínuo(CD); Versionamento (Github, GitLab ou BitBucket); Computação Distribuída (Spark); Orquestrador (Airflow ou Rundeck); Ferramenta de exploração (Jupyter ou Zeppelin); container (Docker, Kubernetes); DB Sql (Mysql, Postgres, Oracle); NoSql (ElasticSearch, MongoDB); Cloud (AWS, Azure, GCP, Dataviz).
Ser uma pessoa colaborativa e gostar de trabalhar em equipe!

Além disso, o que também seria legal você saber?
Metodologias ágeis.

Veja alguns de nossos benefícios!
Plano de Saúde; Plano Odontológico; Seguro de Vida; Vale Refeição; Vale Alimentação; Café da Manhã; Horário Flexível; Home Office; Sem Dress Code; Dextra Snacks; Espaço Fun; Gympass; Biblioteca; Bicicletário; Vestiário; Programa de Mentoria; Plano de carreira; Eventos constantes de compartilhamento de experiências e conhecimentos; Benefícios flexíveis. Para saber mais, fale com a gente!

A Dextra!
Somos especialistas em desenvolvimento de software sob medida dentro da unidade de Transformação Digital do Grupo Mutant. Iniciamos nossos desafios em 2002 e desde então estamos crescendo exponencialmente, presentes no ranking GPTW desde 2009, superando quase 2K de projetos entregues, somando a cultura ágil à rotina de centenas de clientes.

Estamos presentes em Campinas (SP), São Paulo (SP), Curitiba (PR), Ponta Grossa (PR), Florianópolis (SC) e Miami (EUA), mas também temos profissionais atuando 100% remotos.

Atuamos na criação e desenvolvimento de produtos digitais, pioneiros na adoção de metodologias de gestão ágil, combinamos processos de design, UX, novas tecnologias e visão de negócio, desenvolvendo soluções que criam novas oportunidades para nossos clientes.

Cultura!
A nossa cultura é um motivo de orgulho! Por isso é o nosso maior diferencial. Levamos em consideração o comprometimento com o cliente e com a equipe; A valorização da capacidade técnica, da produtividade e da inovação; A colaboração; A Confiança na capacidade das pessoas e Transparência nas relações.

Diversidade!
Apoiamos pessoas independentemente de raça, cor, ancestralidade, religião, sexo, nacionalidade, orientação sexual, idade, cidadania, estado civil, deficiência, identidade de gênero, nível sócio econômico ou qualquer outra característica individual.

Carreira!
Oferecemos todo o apoio para que as pessoas se desenvolvam pessoal e profissionalmente, através de plano de carreira, programa de mentoria, ambiente desafiador e oportunidades de aprendizados constantes.

Então, se você também valoriza tudo isso, curte tecnologias de ponta, muito aprendizado e gosta de novos desafios, aqui é o seu lugar! Isso é a Dextra!

Seja livre para criar e evoluir.

Conheça mais a Dextra pelos nossos canais:

Linked In | Facebook | Instagram | Twitter | Blog | Be Dextra

Voltar para as vagas.",3.3,"Dextra
4.6",Campinas,-1,201 to 500 Employees,-1,Company - Private,Computer Hardware & Software,Information Technology,Less than $1 million (USD),-1
Data Engineer,-1,"Education / Certification

Bachelor’s degree in Computer Science, Statistics or related field or equivalent work experience


Key Qualifications

Able to demonstrate initiative and a proactive approach to daily tasks
Self-motivated and able to take responsibility
Ability to communicate solution design to teammates and clients
Ability to deliver under tight deadlines and pressure
Ability to align the deliverables with the main goal of the project
Punctual and reliable
Flexible attitude
Able to build good relationships at all levels, internally and externally
Able to interact with clients/business users directly
Fluent in English and Portuguese

Role Overview

Advisory in Data Management and Data Strategy
Data manipulation and transformation (hands on and advisory)
Analyse data in the analytics sandbox
Interact with big data tech stack
Data visualization (evaluation graphs, distributions and etc)
Communicate the results to the client/team
Tools

Considerable knowledge about data lineage, relational data and big data principles
Hadoop Ecosystem (HDFS, Spark (including MLLib), Hive / Beeline, Yarn, Kafka, Zookeeper
In Memory Databases (Gemfire, Redis)
Search Engines (Solr, Elastic Search)
Shell Script
Docker
Git
SQL: Min 3 years hands-on experience (basically ETL’s)
Notebooks (Zepellin and Jupyther)
Considerable knowledge in deployment tools such as Cloud Foundry
Desirable:
Python
Scala
Considerable knowledge in MPP principles
Considerable knowledge in Continuous Integration principles",-1,CAPCO,São Paulo,-1,-1,-1,-1,-1,-1,-1,-1
Full Stack | Sr Java Software Engineer,-1,"Senior Software Engineer
The Software Engineering team delivers next-generation application enhancements and new products for a changing world. Working at the cutting edge, we design and develop software for platforms, peripherals, applications and diagnostics — all with the most advanced technologies, tools, software engineering methodologies and the collaboration of internal and external partners.
Join us as a Senior Software Engineer on our Engineering Development team in Eldorado do Sul - Brazil to do the best work of your career and make a profound social impact.

What you’ll achieve
As a Senior Software Engineer, you will be responsible for developing sophisticated systems and software basis the customer’s business goals, needs and general business environment creating software solutions.

You will:
Contribute to the design and architecture of new or re-engineered software environments
Work in a face-paced Agile Development team, with team members, business partners and users distributed globally
Build software as products, within
Develop, review and implement test automation strategies for software products and systems
Be responsible for the whole software development lifecycle, from building software, to automated testing your code, deploying to production, and if required, fixing production code issues.

Take the first step towards your dream career
Every Dell Technologies team member brings something unique to the table. Here’s what we are looking for with this role:

Essential Requirements
Validated knowledge of modern programming languages such as Java, J2EE, front-end development such as Angular or React, cloud-based platforms such as PCF, and databases;
Ability to code/debug more sophisticated programs using either written or verbal design specifications
Capacity to achieve proficiency of new tools, languages and operating systems with training and on-the-job experience
5–8 years of related experience
Fluency in English is required (reading, writing and speaking proficiency).

Desirable Requirements
Bachelor’s degree or equivalent
Experience in implementing comprehensive security requirements that maps to cybersecurity frameworks and cybersecurity best practices

Here’s our story; now tell us yours
Dell Technologies helps organizations and individuals build a brighter digital tomorrow. Our company is made up of more than 150,000 people, located in over 180 locations around the world. We’re proud to be a diverse and inclusive team and have an endless passion for our mission to drive human progress.

What’s most important to us is that you are respected, feel like you can be yourself and have the opportunity to do the best work of your life - while still having a life. We offer excellent benefits, bonus programs, flexible work arrangements, a variety of career development opportunities, employee resource groups, and much more.

We started with computers, but we didn’t stop there. We are helping customers move into the future with multi-cloud, AI and machine learning through the most innovative technology and services portfolio for the data era. Join us and become a part of what’s next in technology, starting today.

You can also learn more about us by reading our latest Diversity and Inclusion Report and our plan to make the world a better place by 2030 here.

Application closing date: 20 Feb 2021

Dell is committed to the principle of equal employment opportunity for all employees and to providing employees with a work environment free of discrimination and harassment. All employment decisions at Dell are based on business needs, job requirements and individual qualifications, without regard to race, color, religion or belief, national, social or ethnic origin, sex (including pregnancy), age, physical, mental or sensory disability, HIV Status, sexual orientation, gender identity and/or expression, marital, civil union or domestic partnership status, past or present military service, family medical history or genetic information, family or parental status, or any other status protected by the laws or regulations in the locations where we operate. Dell will not tolerate discrimination or harassment based on any of these characteristics. Dell encourages applicants of all ages. Read the full Equal Employment Opportunity Policy here.",4.2,"Dell Technologies
4.2",Eldorado do Sul,-1,10000+ Employees,1984,Company - Public,IT Services,Information Technology,$10+ billion (USD),-1
Data Engineer,-1,"Nível: Analista
Área: Tecnologia da Informação
Escolaridade: Graduação - Tecnologia da Informação - Completo
Tipo de contrato: CLT
Jornada de trabalho: Segunda a sexta, 8hs/dia

Responsabilidades e Experiências desejáveis:
Se você é apaixonado por Tecnologia e respira Inovação venha fazer parte do nosso time! AS MELHORES VAGAS DE TECNOLOGIA ESTÃO AQUI!

Responsabilidades e atribuições:
O Data Engineer será responsável por construir e gerenciar pipelines de stream de dados e desenvolver algoritmos para consolidação e geração de informações do uso da frota. Além disso, também deve analisar grande volume da dados e arquitetura para suportar crescimento exponencial e trabalhar bem em equipe, colaborado com colegas e o negócio oferecendo insights para tomadas de decisões.

Requisitos e qualificações:
Conceitos de dados: Data stream, data warehouse, data lake, data visualization
Domínio completo de dados relacionais e não relacionais (SQL e NoSQL)
Domínio em uma linguagem de programação (Python, Java, Scala, etc)
Experiências que são diferenciais:
AWS Redshift ou outro data warehouse
Apache AirFlow
Ferramenta de visualização (PowerBI, Qlik, Tableau etc
Ferramentas de stream e análise de dados (Kafka, Apache Spark, Flink)
AWS
Informações adicionais:
Benefícios oferecidos pela empresa e modelo de contratação CLT;
Desconto especial no aluguel de carros e compra de veículos seminovos
Gympass
Participação nos Lucros e Resultados (PLR)
Plano de Saúde
Plano Odontológico
Previdência Privada
Rede de benefícios e descontos Allya
Seguro de Vida
Vale Alimentação
Vale Transporte
Universidade Localiza (treinamentos online para seu desenvolvimento)
Programa de Apoio a Gestantes.",-1,MP HR Solutions,Curitiba,-1,-1,-1,-1,-1,-1,-1,-1
